{
  "$schema": "https://json-schema.org/draft/2020-12/schema",
  "$id": "https://raw.githubusercontent.com/raillen/prumo/main/schemas/prumo.schema.json",
  "type": "object",
  "required": [
    "version",
    "framework",
    "project",
    "documentation",
    "context",
    "intelligence",
    "orchestration",
    "goals",
    "ai",
    "protocol"
  ],
  "properties": {
    "version": {
      "type": "integer",
      "minimum": 2
    },
    "protocol": {
      "type": "object",
      "properties": {
        "version": {
          "type": "integer",
          "minimum": 1
        },
        "compatible": {
          "type": "string"
        }
      },
      "additionalProperties": true
    },
    "framework": {
      "type": "object",
      "required": [
        "name",
        "version"
      ],
      "properties": {
        "name": {
          "const": "prumo"
        },
        "version": {
          "type": "string",
          "minLength": 1
        }
      },
      "additionalProperties": true
    },
    "project": {
      "type": "object",
      "required": [
        "name",
        "type"
      ],
      "properties": {
        "name": {
          "type": "string",
          "minLength": 1
        },
        "type": {
          "oneOf": [
            {
              "type": "string",
              "minLength": 1
            },
            {
              "type": "array",
              "minItems": 1,
              "items": {
                "type": "string",
                "minLength": 1
              }
            }
          ]
        }
      },
      "additionalProperties": true
    },
    "stack": {
      "type": "object"
    },
    "features": {
      "type": "array",
      "items": {
        "type": "string"
      }
    },
    "risk": {
      "type": "array",
      "items": {
        "type": "string"
      }
    },
    "quality": {
      "type": "object"
    },
    "documentation": {
      "type": "object",
      "required": [
        "entrypoint",
        "canonical_format",
        "site",
        "audiences"
      ],
      "properties": {
        "entrypoint": {
          "type": "string"
        },
        "canonical_format": {
          "const": "markdown"
        },
        "site": {
          "type": "object"
        },
        "audiences": {
          "type": "array",
          "items": {
            "type": "string"
          }
        },
        "virtual_chunking": {
          "type": ["boolean", "string"]
        }
      },
      "additionalProperties": true
    },
    "context": {
      "type": "object",
      "required": [
        "methodology",
        "mode",
        "profiles",
        "deep_recursion",
        "runtime"
      ],
      "properties": {
        "methodology": {
          "const": "lean-progressive-context"
        },
        "architecture": {
          "type": "string"
        },
        "mode": {
          "enum": [
            "legacy",
            "progressive"
          ]
        },
        "budget_profile": {
          "type": "string"
        },
        "profiles": {
          "type": "object",
          "minProperties": 1
        },
        "deep_recursion": {
          "type": "object",
          "required": [
            "enabled"
          ],
          "properties": {
            "enabled": {
              "type": ["boolean", "string"]
            }
          },
          "additionalProperties": true
        },
        "runtime": {
          "type": "object"
        }
      },
      "additionalProperties": true
    },
    "intelligence": {
      "type": "object",
      "required": [
        "enabled",
        "path"
      ],
      "properties": {
        "enabled": {
          "type": ["boolean", "string"]
        },
        "path": {
          "type": "string",
          "minLength": 1
        }
      },
      "additionalProperties": true
    },
    "orchestration": {
      "type": "object",
      "required": [
        "protocol",
        "orchestrator"
      ],
      "properties": {
        "protocol": {
          "type": "string"
        },
        "orchestrator": {
          "type": "string"
        }
      },
      "additionalProperties": true
    },
    "goals": {
      "type": "object",
      "required": [
        "active_phase"
      ],
      "properties": {
        "active_phase": {
          "type": "string"
        }
      },
      "additionalProperties": true
    },
    "ai": {
      "type": "object",
      "required": [
        "preferred_models"
      ],
      "properties": {
        "preferred_models": {
          "type": "array",
          "minItems": 1
        }
      },
      "additionalProperties": true
    },
    "permissions": {
      "type": "object"
    },
    "execution": {
      "type": "object"
    }
  },
  "additionalProperties": true
}